{
  "schemaVersion": "transit-coordinate-v1",
  "artifactVersion": "fixture-coordinate-v1",
  "masterVersion": "fixture-master-v1",
  "coordinateSystem": "WGS84",
  "generatedAt": "2026-09-16T00:00:00Z",
  "records": [
    {
      "mode": "BUS",
      "providerNamespace": "SEOUL_BUS",
      "providerRouteId": "100100118",
      "providerLineId": null,
      "providerStopId": "102000001",
      "canonicalNodeId": "BUS_STOP:SEOUL_BUS:102000001",
      "occurrence": 1,
      "direction": "UP",
      "longitude": 126.9784,
      "latitude": 37.5667,
      "coordinateType": "STOP_POINT",
      "source": "SYNTHETIC_FIXTURE",
      "sourceRef": "fixture:bus:1",
      "masterVersion": "fixture-master-v1",
      "validFrom": null,
      "validUntil": null,
      "mappingStatus": "EXACT",
      "evidence": "synthetic contract fixture; not production data"
    },
    {
      "mode": "SUBWAY",
      "providerNamespace": "METROPOLITAN_SUBWAY",
      "providerRouteId": null,
      "providerLineId": "1002",
      "providerStopId": "1002000201",
      "canonicalNodeId": "SUBWAY_STATION:0201",
      "occurrence": 1,
      "direction": "UP",
      "longitude": 126.9751,
      "latitude": 37.5636,
      "coordinateType": "STATION_CENTER",
      "source": "SYNTHETIC_FIXTURE",
      "sourceRef": "fixture:subway:1",
      "masterVersion": "fixture-master-v1",
      "validFrom": null,
      "validUntil": null,
      "mappingStatus": "EXACT",
      "evidence": "station center only; must not be interpreted as an entrance"
    },
    {
      "mode": "SUBWAY",
      "providerNamespace": "METROPOLITAN_SUBWAY",
      "providerRouteId": null,
      "providerLineId": "1002",
      "providerStopId": "missing-coordinate",
      "canonicalNodeId": "SUBWAY_STATION:MISSING",
      "occurrence": 1,
      "direction": "DOWN",
      "longitude": null,
      "latitude": null,
      "coordinateType": "UNKNOWN",
      "source": "UNAVAILABLE",
      "sourceRef": "fixture:subway:missing",
      "masterVersion": "fixture-master-v1",
      "validFrom": null,
      "validUntil": null,
      "mappingStatus": "UNMAPPED",
      "evidence": "missing coordinate is preserved and must trigger walking fallback"
    }
  ]
}
